{
  "$schema": "https://json-schema.org/draft/2020-12/schema",
  "$id": "urn:aibridge:contracts:v1:project",
  "title": "Project",
  "description": "@generated by scripts/generate-contracts.ts from src/orchestration/schemas.ts:135 (export projectSchema). DO NOT EDIT. Invariants from .refine()/.superRefine() are NOT representable in JSON Schema and are absent from this file; they remain enforced by the TypeScript engine, which is the sole authority for them (ADR 0008 §2.2 Tier 2).",
  "type": "object",
  "properties": {
    "schemaVersion": {
      "anyOf": [
        {
          "type": "number",
          "const": 1,
          "title": "ProjectSchemaVersion0"
        },
        {
          "type": "number",
          "const": 2,
          "title": "ProjectSchemaVersion1"
        }
      ]
    },
    "projectId": {
      "type": "string",
      "pattern": "^[A-Za-z0-9][A-Za-z0-9._:-]{0,127}$",
      "title": "ProjectProjectId"
    },
    "meshId": {
      "type": "string",
      "pattern": "^[A-Za-z0-9][A-Za-z0-9._:-]{0,127}$",
      "title": "ProjectMeshId"
    },
    "name": {
      "type": "string",
      "minLength": 1,
      "maxLength": 256,
      "title": "ProjectName"
    },
    "pathBindings": {
      "maxItems": 128,
      "type": "array",
      "items": {
        "type": "object",
        "properties": {
          "schemaVersion": {
            "anyOf": [
              {
                "type": "number",
                "const": 1,
                "title": "ProjectPathBindingsSchemaVersion0"
              },
              {
                "type": "number",
                "const": 2,
                "title": "ProjectPathBindingsSchemaVersion1"
              }
            ]
          },
          "projectPathId": {
            "type": "string",
            "pattern": "^[A-Za-z0-9][A-Za-z0-9._:-]{0,127}$",
            "title": "ProjectPathBindingsProjectPathId"
          },
          "projectId": {
            "type": "string",
            "pattern": "^[A-Za-z0-9][A-Za-z0-9._:-]{0,127}$",
            "title": "ProjectPathBindingsProjectId"
          },
          "nodeId": {
            "type": "string",
            "pattern": "^[A-Za-z0-9][A-Za-z0-9._:-]{0,127}$",
            "title": "ProjectPathBindingsNodeId"
          },
          "configuredPath": {
            "type": "string",
            "minLength": 1,
            "maxLength": 4096,
            "title": "ProjectPathBindingsConfiguredPath"
          },
          "allowedCapabilities": {
            "maxItems": 128,
            "type": "array",
            "items": {
              "type": "string",
              "pattern": "^[A-Za-z0-9][A-Za-z0-9._:-]{0,127}$",
              "title": "ProjectPathBindingsAllowedCapabilities"
            },
            "title": "ProjectPathBindingsAllowedCapabilities"
          }
        },
        "required": [
          "schemaVersion",
          "projectPathId",
          "projectId",
          "nodeId",
          "configuredPath",
          "allowedCapabilities"
        ],
        "additionalProperties": false
      },
      "title": "ProjectPathBindings"
    }
  },
  "required": [
    "schemaVersion",
    "projectId",
    "meshId",
    "name",
    "pathBindings"
  ],
  "additionalProperties": false
}
