{
  "schemaVersion": 1,
  "projectId": "project-contract",
  "meshId": "mesh-contract",
  "name": "Contract project",
  "pathBindings": [
    {
      "schemaVersion": 1,
      "projectPathId": "project-path-contract",
      "projectId": "project-contract",
      "nodeId": "node-contract",
      "configuredPath": "/srv/aibridge/contract-project",
      "allowedCapabilities": ["read"]
    }
  ]
}
